{
  "idea_id":"KV-000002",
  "title_internal":"Cuánto más debes vender después de dar un descuento",
  "topic":"pricing",
  "subtopic":"discount-volume-math",
  "problem_or_decision":"Dar descuentos sin calcular cuánto volumen adicional exige conservar el mismo beneficio bruto/contribución total.",
  "audience":["freelancers","microempresas","comercio"],
  "main_claim":"Cuando un descuento reduce la ganancia por unidad, conservar la misma ganancia total exige vender más unidades; el aumento depende del margen previo y del descuento.",
  "practical_value":"Convierte un descuento aparentemente pequeño en una decisión cuantificable.",
  "explanation":"Si precio=100 y costo variable=60, la contribución es 40. Con 10% de descuento, precio=90 y contribución=30. Para conservar 40 de contribución total se requiere 40/30=1,333 veces el volumen: 33,3% más unidades.",
  "example":"Con 40% de margen sobre venta y 10% de descuento, en este ejemplo se necesita aproximadamente 33,3% más volumen para conservar la misma contribución total.",
  "primary_sources":[{"title":"Margin vs markup","publisher":"Xero","published_at":"2026-07-23","url_or_reference":"https://www.xero.com/us/glossary/margin-vs-markup/","retrieved_at":"2026-09-05"}],
  "secondary_sources":["Arithmetic derivation recorded in explanation."],
  "source_status":"SUPPORTED",
  "confidence":"A",
  "qa_tier":"QA-B",
  "interpretation_risks":["El ejemplo asume costo variable por unidad estable.","No equivale automáticamente a beneficio neto."],
  "forbidden_overclaims":["Decir que todo descuento de 10% siempre exige 33,3% más ventas."],
  "content_franchise":"Errores caros",
  "angles":["El descuento que te obliga a vender mucho más","Antes de descontar, calcula esto"],
  "hooks":["Un 10% de descuento puede obligarte a vender bastante más de 10% extra."],
  "platform_potential":{"instagram":10,"facebook":9,"linkedin":10},
  "score":{"utility":10,"novelty":9,"clarity":9,"shareability":10,"saveability":10,"brand_fit":10,"commercial_signal":10},
  "status":"VERIFIED",
  "publication_ids":[],
  "experiment_ids":[],
  "created_at":"2026-09-05",
  "verified_at":"2026-09-05",
  "last_updated_at":"2026-09-05"
}