{
  "idea_id":"KV-000012",
  "title_internal":"Revisiones ilimitadas convierten alcance en costo oculto",
  "topic":"freelancing",
  "subtopic":"scope-creep-effective-rate",
  "problem_or_decision":"Aceptar cambios no acotados sin medir cómo aumentan horas y reducen la tarifa efectiva.",
  "audience":["freelancers","agencias","servicios profesionales"],
  "main_claim":"Si el precio del proyecto permanece fijo pero aumentan las horas no cobradas por revisiones, la tarifa efectiva por hora disminuye aritméticamente.",
  "practical_value":"Convierte el scope creep en un número visible y defendible al definir alcance y revisiones.",
  "explanation":"Es una identidad aritmética: tarifa efectiva = ingreso del proyecto / horas totales reales. Con precio fijo, cada hora adicional no facturada reduce ese cociente.",
  "example":"Proyecto de 1.000 previsto para 10 horas = 100/h. Si termina consumiendo 15 horas por cambios no cobrados, la tarifa efectiva cae a 66,67/h.",
  "primary_sources":[],
  "secondary_sources":["Transparent arithmetic derivation in explanation."],
  "source_status":"SUPPORTED",
  "confidence":"A",
  "qa_tier":"QA-C",
  "interpretation_risks":["No toda revisión es scope creep; algunas deben estar incluidas contractualmente."],
  "forbidden_overclaims":["Presentar todo cambio del cliente como abuso o costo indebido."],
  "content_franchise":"Errores caros",
  "angles":["La revisión que baja tu tarifa sin que cambie el precio","Mide tus cambios en tarifa efectiva"],
  "hooks":["Tu precio puede no cambiar y aun así tu tarifa real desplomarse."],
  "platform_potential":{"instagram":10,"facebook":9,"linkedin":10},
  "score":{"utility":10,"novelty":8,"clarity":10,"shareability":10,"saveability":10,"brand_fit":10,"commercial_signal":10},
  "status":"VERIFIED",
  "publication_ids":[],
  "experiment_ids":[],
  "created_at":"2026-09-05",
  "verified_at":"2026-09-05",
  "last_updated_at":"2026-09-05"
}