{
  "idea_id":"KV-000009",
  "title_internal":"CAC sin contribución: crecer puede empeorar la economía por cliente",
  "topic":"marketing economics",
  "subtopic":"unit-economics",
  "problem_or_decision":"Celebrar adquisición de clientes sin medir costo de adquisición y contribución económica por cliente/unidad.",
  "audience":["emprendedores","marketing","microempresas"],
  "main_claim":"Las unit economics comparan ingresos y costos a nivel de cliente o unidad; CAC y margen de contribución deben analizarse juntos para saber si el crecimiento mejora o deteriora la economía del modelo.",
  "practical_value":"Evita interpretar más clientes como crecimiento saludable sin comprobar cuánto cuesta conseguirlos y servirlos.",
  "explanation":"La guía de modelación financiera de GOV.UK define unit economics como ingresos y costos por unidad, incluyendo CAC, LTV y contribution margin. Si el costo de adquirir/servir una unidad supera su contribución, aumentar unidades replica una economía desfavorable bajo esos supuestos.",
  "example":"Si adquirir un cliente cuesta 30 y su contribución esperada antes de costos fijos es 20, sumar clientes no corrige por sí solo esa relación.",
  "primary_sources":[{"title":"Track 1: Financial Model Essentials — Unit economics","publisher":"GOV.UK","published_at":"2025","url_or_reference":"https://www.gov.uk/government/publications/unlocking-space-for-investment-growth-hub/track-1-financial-model-essentials","retrieved_at":"2026-09-05"}],
  "secondary_sources":[],
  "source_status":"PRIMARY_VERIFIED",
  "confidence":"A",
  "qa_tier":"QA-B",
  "interpretation_risks":["LTV y CAC dependen de ventana temporal, cohortes y definición de costos."],
  "forbidden_overclaims":["Decir que CAC mayor que contribución inicial siempre invalida un negocio sin considerar recurrencia y LTV correctamente calculado."],
  "content_franchise":"Errores caros",
  "angles":["Más clientes no siempre arreglan la economía","La métrica que falta cuando celebras adquisición"],
  "hooks":["Puedes conseguir más clientes y empeorar el problema si cada uno trae una economía negativa."],
  "platform_potential":{"instagram":8,"facebook":8,"linkedin":10},
  "score":{"utility":10,"novelty":8,"clarity":8,"shareability":8,"saveability":9,"brand_fit":10,"commercial_signal":10},
  "status":"VERIFIED",
  "publication_ids":[],
  "experiment_ids":[],
  "created_at":"2026-09-05",
  "verified_at":"2026-09-05",
  "last_updated_at":"2026-09-05"
}