{
  "idea_id":"KV-000005",
  "title_internal":"Por qué una tercera opción puede hacer que elijas otra",
  "topic":"behavioral economics",
  "subtopic":"asymmetric-dominance-decoy",
  "problem_or_decision":"Comparar ofertas solo de forma relativa dentro del conjunto presentado.",
  "audience":["consumidores","marketing","ventas","emprendedores"],
  "main_claim":"Añadir una alternativa asimétricamente dominada puede aumentar la probabilidad de elegir la opción que la domina.",
  "practical_value":"Enseña a comparar opciones por valor absoluto y necesidades propias, no solo por contraste con una tercera opción.",
  "explanation":"Huber, Payne y Puto mostraron que una alternativa dominada por una opción pero no por otra puede alterar probabilidades de elección.",
  "example":"Una tercera oferta puede hacer que una de las dos originales parezca relativamente mejor aunque sus características no hayan cambiado.",
  "primary_sources":[{"title":"Adding Asymmetrically Dominated Alternatives: Violations of Regularity and the Similarity Hypothesis","publisher":"Journal of Consumer Research / Oxford Academic","published_at":"1982-06-01","url_or_reference":"https://doi.org/10.1086/208899","retrieved_at":"2026-09-05"}],
  "secondary_sources":[],
  "source_status":"PRIMARY_VERIFIED",
  "confidence":"A",
  "qa_tier":"QA-B",
  "interpretation_risks":["El efecto puede ocurrir; no es universal ni garantiza una elección concreta."],
  "forbidden_overclaims":["Afirmar que toda tercera opción es un señuelo deliberado.","Prometer que añadir un señuelo siempre aumenta ventas."],
  "content_franchise":"Lo que nadie te explica",
  "angles":["La opción que quizá está ahí para que otra parezca mejor","Tres precios pueden cambiar una comparación"],
  "hooks":["A veces una tercera opción cambia tu elección sin mejorar ninguna de las dos que ya tenías."],
  "platform_potential":{"instagram":10,"facebook":9,"linkedin":9},
  "score":{"utility":9,"novelty":10,"clarity":8,"shareability":10,"saveability":8,"brand_fit":9,"commercial_signal":9},
  "status":"VERIFIED",
  "publication_ids":[],
  "experiment_ids":[],
  "created_at":"2026-09-05",
  "verified_at":"2026-09-05",
  "last_updated_at":"2026-09-05"
}