{
  "idea_id":"KV-000020",
  "title_internal":"El precio por unidad puede contar una historia distinta al precio total",
  "topic":"consumer economics",
  "subtopic":"unit-pricing",
  "problem_or_decision":"Comparar ofertas por precio total cuando los tamaños, cantidades o unidades son diferentes.",
  "audience":["consumidores","microempresas","compradores"],
  "main_claim":"Normalizar el precio a una unidad comparable —por peso, volumen, cantidad u otra medida pertinente— permite comparar productos de tamaños diferentes y puede revelar que el paquete de mayor precio o tamaño no es el mejor valor por unidad.",
  "practical_value":"Una regla simple para comparar ofertas sin dejarse llevar por el tamaño del envase o el precio total.",
  "explanation":"NIST y autoridades de competencia/consumo describen el unit pricing como precio por unidad de medida para facilitar comparaciones entre tamaños y cantidades. El precio unitario se obtiene dividiendo el precio por una medida común compatible.",
  "example":"Producto A: 500 g por 3.000 = 6 por gramo. Producto B: 800 g por 4.400 = 5,5 por gramo. B cuesta más en total, pero menos por gramo en este ejemplo.",
  "primary_sources":[{"title":"Uniform Unit Pricing: Tools for Consumers to Fight Shrinkflation","publisher":"NIST Office of Weights and Measures","published_at":null,"url_or_reference":"https://www.nist.gov/programs-projects/uniform-unit-pricing-tools-consumers-fight-shrinkflation","retrieved_at":"2026-09-05"},{"title":"Unit pricing: information for consumers","publisher":"UK Government / Competition and Markets Authority","published_at":"2015-07-16","url_or_reference":"https://www.gov.uk/government/publications/unit-pricing-information-for-consumers/unit-pricing-information-for-consumers","retrieved_at":"2026-09-05"}],
  "secondary_sources":[],
  "source_status":"PRIMARY_VERIFIED",
  "confidence":"A",
  "qa_tier":"QA-C",
  "interpretation_risks":["El menor precio por unidad no siempre es la mejor decisión si calidad, desperdicio, duración, necesidad o características difieren.","Las unidades deben normalizarse de forma compatible."],
  "forbidden_overclaims":["Decir que el producto con menor precio unitario siempre es la mejor compra.","Comparar unidades incompatibles sin conversión."],
  "content_franchise":"El número que importa",
  "angles":["El paquete más grande no siempre es el más barato","Compara por unidad, no por impresión"],
  "hooks":["Dos precios totales pueden engañarte si los tamaños son distintos. Divide antes de elegir."],
  "platform_potential":{"instagram":10,"facebook":10,"linkedin":7},
  "score":{"utility":10,"novelty":7,"clarity":10,"shareability":10,"saveability":10,"brand_fit":9,"commercial_signal":6},
  "status":"VERIFIED",
  "publication_ids":[],
  "experiment_ids":[],
  "created_at":"2026-09-05",
  "verified_at":"2026-09-05",
  "last_updated_at":"2026-09-05"
}
