{
  "idea_id":"KV-000001",
  "title_internal":"Margen y markup no son lo mismo",
  "topic":"pricing",
  "subtopic":"margin-vs-markup",
  "problem_or_decision":"Fijar precios sin confundir el porcentaje aplicado sobre costo con el porcentaje de ganancia sobre venta.",
  "audience":["freelancers","microempresas","emprendedores"],
  "main_claim":"Markup y margen usan bases distintas: markup divide la ganancia por el costo; margen la divide por el precio de venta.",
  "practical_value":"Evita sobreestimar rentabilidad al fijar precios.",
  "explanation":"Con costo 40 y precio 60, la ganancia es 20: markup=20/40=50%; margen=20/60=33,3%.",
  "example":"Un markup de 50% no produce un margen de 50%; produce aproximadamente 33,3%.",
  "primary_sources":[{"title":"Margin vs markup","publisher":"Xero","published_at":"2026-07-23","url_or_reference":"https://www.xero.com/us/glossary/margin-vs-markup/","retrieved_at":"2026-09-05"}],
  "secondary_sources":[],
  "source_status":"PRIMARY_VERIFIED",
  "confidence":"A",
  "qa_tier":"QA-B",
  "interpretation_risks":["No presentar margen bruto como beneficio neto."],
  "forbidden_overclaims":["Confundir la diferencia contable con una garantía de rentabilidad."],
  "content_franchise":"El número que importa",
  "angles":["50% de markup no es 50% de margen","La fórmula que cambia un precio"],
  "hooks":["Puedes subir 50% tu costo y aun así no tener 50% de margen."],
  "platform_potential":{"instagram":9,"facebook":8,"linkedin":9},
  "score":{"utility":10,"novelty":8,"clarity":10,"shareability":9,"saveability":10,"brand_fit":10,"commercial_signal":10},
  "status":"VERIFIED",
  "publication_ids":[],
  "experiment_ids":[],
  "created_at":"2026-09-05",
  "verified_at":"2026-09-05",
  "last_updated_at":"2026-09-05"
}