{
  "idea_id":"KV-000011",
  "title_internal":"Un negocio rentable puede tener problemas de caja",
  "topic":"cash-flow",
  "subtopic":"cash-flow-vs-profit",
  "problem_or_decision":"Confundir rentabilidad contable con efectivo disponible para pagar obligaciones en el momento necesario.",
  "audience":["microempresas","freelancers","emprendedores"],
  "main_claim":"Profit y cash flow miden cosas distintas; una empresa puede mostrar beneficio y aun no tener suficiente efectivo disponible en un momento concreto.",
  "practical_value":"Hace visible el riesgo del calendario de cobros y pagos.",
  "explanation":"Xero destaca que el beneficio por sí solo no indica si hay efectivo suficiente para pagar facturas, salarios y operación diaria.",
  "example":"Puedes reconocer una venta rentable hoy pero cobrar en 60 días mientras proveedores y nómina vencen antes.",
  "primary_sources":[{"title":"Cash flow vs profit: differences and why they matter","publisher":"Xero","published_at":"2026-04-17","url_or_reference":"https://www.xero.com/uk/guides/cash-flow-vs-profit-differences/","retrieved_at":"2026-09-05"}],
  "secondary_sources":[],
  "source_status":"PRIMARY_VERIFIED",
  "confidence":"A",
  "qa_tier":"QA-B",
  "interpretation_risks":["Ejemplos dependen de método contable, plazos y estructura financiera."],
  "forbidden_overclaims":["Decir que una empresa con cash flow negativo en un periodo necesariamente es inviable."],
  "content_franchise":"Cómo funciona realmente",
  "angles":["Rentable en papel, sin efectivo en la cuenta","La diferencia entre ganar y poder pagar hoy"],
  "hooks":["Puedes tener beneficio y aun así no tener caja suficiente para pagar este mes."],
  "platform_potential":{"instagram":9,"facebook":9,"linkedin":10},
  "score":{"utility":10,"novelty":8,"clarity":9,"shareability":9,"saveability":10,"brand_fit":10,"commercial_signal":10},
  "status":"VERIFIED",
  "publication_ids":[],
  "experiment_ids":[],
  "created_at":"2026-09-05",
  "verified_at":"2026-09-05",
  "last_updated_at":"2026-09-05"
}