{
  "idea_id":"KV-000018",
  "title_internal":"Exportar tus datos antes de depender de una herramienta",
  "topic":"digital tools",
  "subtopic":"data-portability-exit-risk",
  "problem_or_decision":"Convertir una herramienta en infraestructura crítica sin comprobar cómo recuperar o mover los datos si se cambia de proveedor.",
  "audience":["freelancers","microempresas","profesionales","equipos digitales"],
  "main_claim":"La capacidad de exportar datos en formatos utilizables mejora la portabilidad y simplifica migraciones; comprobar esa capacidad antes de depender de una herramienta reduce riesgo de salida, aunque no garantiza una migración perfecta.",
  "practical_value":"Introduce una verificación simple de reversibilidad antes de concentrar trabajo crítico en una plataforma.",
  "explanation":"NIST identifica la portabilidad de aplicaciones y datos como una consideración clave para evitar lock-in y señala que exportar a formatos estándar simplifica migraciones. Google Takeout muestra un ejemplo práctico de exportación y ofrece formatos portables para distintos tipos de datos.",
  "example":"Antes de llevar clientes, documentos o calendario a una herramienta, comprobar qué se puede exportar, en qué formato, qué metadatos conserva y si el archivo puede abrirse fuera de esa plataforma.",
  "primary_sources":[{"title":"NIST US Government Cloud Computing Technology Roadmap, Volume II","publisher":"NIST","published_at":null,"url_or_reference":"https://www.nist.gov/system/files/documents/itl/cloud/SP_500_293_volumeII.pdf","retrieved_at":"2026-09-05"},{"title":"How to download your Google data","publisher":"Google Account Help","published_at":null,"url_or_reference":"https://support.google.com/accounts/answer/3024190","retrieved_at":"2026-09-05"}],
  "secondary_sources":[],
  "source_status":"PRIMARY_VERIFIED",
  "confidence":"A",
  "qa_tier":"QA-C",
  "interpretation_risks":["Tener una función de exportación no garantiza compatibilidad total con otra herramienta.","Un archivo exportado puede perder relaciones, automatizaciones, permisos o metadatos según el sistema."],
  "forbidden_overclaims":["Afirmar que cualquier exportación elimina el vendor lock-in.","Decir que un formato como CSV o JSON conserva siempre toda la funcionalidad de origen."],
  "content_franchise":"Herramienta que vale conocer",
  "angles":["La función que deberías revisar antes de enamorarte de una app","Tu plan de salida empieza antes de entrar"],
  "hooks":["Antes de convertir una app en parte crítica de tu negocio, intenta salir de ella."],
  "platform_potential":{"instagram":9,"facebook":8,"linkedin":10},
  "score":{"utility":10,"novelty":9,"clarity":9,"shareability":9,"saveability":10,"brand_fit":10,"commercial_signal":8},
  "status":"VERIFIED",
  "publication_ids":[],
  "experiment_ids":[],
  "created_at":"2026-09-05",
  "verified_at":"2026-09-05",
  "last_updated_at":"2026-09-05"
}
