{
  "idea_id":"KV-000003",
  "title_internal":"Punto de equilibrio: el número que muchas microempresas no calculan",
  "topic":"small-business finance",
  "subtopic":"break-even",
  "problem_or_decision":"No saber cuántas unidades o ventas hacen falta para cubrir costos fijos.",
  "audience":["microempresas","freelancers","emprendedores"],
  "main_claim":"El punto de equilibrio en unidades puede calcularse como costos fijos divididos por precio unitario menos costo variable unitario.",
  "practical_value":"Convierte costos y precios en una meta mínima de ventas comprensible.",
  "explanation":"La SBA expresa el break-even en unidades como fixed costs / (sales price per unit - variable cost per unit).",
  "example":"Costos fijos 1.000; precio 50; costo variable 30: 1.000/(50-30)=50 unidades para alcanzar el punto de equilibrio bajo esos supuestos.",
  "primary_sources":[{"title":"Break-even point","publisher":"U.S. Small Business Administration","published_at":null,"url_or_reference":"https://legacy.sba.gov/business-guide/plan-your-business/calculate-your-startup-costs/break-even-point","retrieved_at":"2026-09-05"}],
  "secondary_sources":[],
  "source_status":"PRIMARY_VERIFIED",
  "confidence":"A",
  "qa_tier":"QA-B",
  "interpretation_risks":["Supone clasificación correcta de costos fijos/variables y condiciones suficientemente estables."],
  "forbidden_overclaims":["Presentar el break-even como garantía de solvencia o beneficio neto futuro."],
  "content_franchise":"El número que importa",
  "angles":["El número mínimo antes de pensar en ganar","Cuánto debes vender para dejar de perder"],
  "hooks":["Antes de preguntar cuánto puedes ganar, calcula cuánto necesitas vender para quedar en cero."],
  "platform_potential":{"instagram":9,"facebook":9,"linkedin":10},
  "score":{"utility":10,"novelty":7,"clarity":9,"shareability":8,"saveability":10,"brand_fit":10,"commercial_signal":10},
  "status":"VERIFIED",
  "publication_ids":[],
  "experiment_ids":[],
  "created_at":"2026-09-05",
  "verified_at":"2026-09-05",
  "last_updated_at":"2026-09-05"
}