{
  "idea_id":"KV-000007",
  "title_internal":"El costo hundido: seguir porque ya invertiste",
  "topic":"decision-making",
  "subtopic":"sunk-cost-effect",
  "problem_or_decision":"Mantener un proyecto, compra o compromiso principalmente porque ya se invirtió dinero, esfuerzo o tiempo.",
  "audience":["personas","freelancers","emprendedores","microempresas"],
  "main_claim":"El efecto de costo hundido describe una mayor tendencia a continuar un esfuerzo una vez que ya se invirtió dinero, esfuerzo o tiempo.",
  "practical_value":"Ayuda a separar lo ya irrecuperable de los costos y beneficios futuros de una decisión.",
  "explanation":"Arkes y Blumer documentaron el sunk cost effect en estudios de campo y cuestionarios: inversiones previas pueden aumentar la tendencia a continuar.",
  "example":"Haber pagado por una herramienta que ya no sirve no vuelve rentable seguir usándola si una alternativa futura ofrece mejor resultado total.",
  "primary_sources":[{"title":"The psychology of sunk cost","publisher":"Organizational Behavior and Human Decision Processes / Elsevier","published_at":"1985-02-01","url_or_reference":"https://doi.org/10.1016/0749-5978(85)90049-4","retrieved_at":"2026-09-05"}],
  "secondary_sources":[],
  "source_status":"PRIMARY_VERIFIED",
  "confidence":"A",
  "qa_tier":"QA-B",
  "interpretation_risks":["Una inversión pasada puede contener información útil; el punto es no tratar el gasto irrecuperable como beneficio futuro."],
  "forbidden_overclaims":["Afirmar que siempre debe abandonarse un proyecto que ya consumió recursos."],
  "content_franchise":"Errores caros",
  "angles":["Ya pagaste no significa que debas seguir","La inversión pasada que se mete en una decisión futura"],
  "hooks":["Lo que ya gastaste puede empujarte a gastar todavía más, aunque ya no cambie el futuro."],
  "platform_potential":{"instagram":9,"facebook":9,"linkedin":10},
  "score":{"utility":9,"novelty":8,"clarity":9,"shareability":9,"saveability":9,"brand_fit":9,"commercial_signal":7},
  "status":"VERIFIED",
  "publication_ids":[],
  "experiment_ids":[],
  "created_at":"2026-09-05",
  "verified_at":"2026-09-05",
  "last_updated_at":"2026-09-05"
}