{
  "idea_id":"KV-000014",
  "title_internal":"Cobrar anticipo cambia el riesgo de caja del proyecto",
  "topic":"freelancing",
  "subtopic":"advance-payment-cash-flow",
  "problem_or_decision":"Financiar materiales, tiempo o costos iniciales del proyecto con caja propia hasta que el cliente pague.",
  "audience":["freelancers","agencias","microempresas","servicios profesionales"],
  "main_claim":"Un anticipo cambia el calendario de cobros y puede reducir la cantidad de capital propio que el proveedor necesita adelantar durante la ejecución; no elimina el riesgo contractual ni garantiza rentabilidad.",
  "practical_value":"Hace visible que la estructura de pagos también es una decisión de capital de trabajo, no solo una condición administrativa.",
  "explanation":"Las normas federales de contratación de EE.UU. tratan los pagos anticipados como financiación contractual vinculada a necesidades intermedias de caja y exigen analizar desembolsos y cobros previstos. El principio operativo general es que recibir parte del precio antes modifica el desfase entre salidas y entradas de efectivo.",
  "example":"Proyecto de 1.000 con 400 de desembolsos antes del cobro final. Sin anticipo, el proveedor debe financiar esos 400 durante el desfase. Con un anticipo de 500, el calendario de caja cambia y esos desembolsos pueden cubrirse con el ingreso anticipado, bajo los supuestos del ejemplo.",
  "primary_sources":[{"title":"32.408 Application for advance payments","publisher":"Acquisition.gov / Federal Acquisition Regulation","published_at":"2026-03-13","url_or_reference":"https://www.acquisition.gov/far/32.408","retrieved_at":"2026-09-05"},{"title":"32.402 General","publisher":"Acquisition.gov / Federal Acquisition Regulation","published_at":"2026-03-13","url_or_reference":"https://www.acquisition.gov/far/32.402","retrieved_at":"2026-09-05"}],
  "secondary_sources":[],
  "source_status":"PRIMARY_VERIFIED",
  "confidence":"A",
  "qa_tier":"QA-B",
  "interpretation_risks":["Las prácticas, garantías, impuestos y reglas legales dependen del contrato y jurisdicción.","Un anticipo puede crear obligaciones de devolución o ejecución; no elimina riesgo de impago, disputa o incumplimiento."],
  "forbidden_overclaims":["Decir que siempre debe cobrarse 50% por adelantado.","Presentar el anticipo como garantía de rentabilidad o eliminación total del riesgo."],
  "content_franchise":"Cómo funciona realmente",
  "angles":["El anticipo no solo cambia cuándo cobras: cambia quién financia el inicio","Precio y calendario de cobro son dos decisiones distintas"],
  "hooks":["Dos proyectos con el mismo precio pueden exigir cantidades muy distintas de tu propia caja."],
  "platform_potential":{"instagram":9,"facebook":8,"linkedin":10},
  "score":{"utility":10,"novelty":8,"clarity":9,"shareability":8,"saveability":10,"brand_fit":10,"commercial_signal":10},
  "status":"VERIFIED",
  "publication_ids":[],
  "experiment_ids":[],
  "created_at":"2026-09-05",
  "verified_at":"2026-09-05",
  "last_updated_at":"2026-09-05"
}
