{
  "idea_id":"KV-000019",
  "title_internal":"Una automatización barata puede salir cara si no tiene confirmación",
  "topic":"automation",
  "subtopic":"idempotency-confirmation-logging",
  "problem_or_decision":"Automatizar acciones con efectos reales sin controlar reintentos, duplicados ni confirmación de resultado.",
  "audience":["microempresas","freelancers","equipos digitales","personas que automatizan"],
  "main_claim":"En automatizaciones que pueden reintentarse, mecanismos de idempotencia o deduplicación ayudan a evitar ejecutar la misma operación más de una vez; además, confirmar y registrar el resultado facilita detectar fallos o duplicados.",
  "practical_value":"Introduce tres controles simples antes de automatizar correos, publicaciones, facturas, pagos u otras acciones con efectos reales: identidad de operación, confirmación y registro.",
  "explanation":"Stripe documenta idempotency keys para repetir solicitudes de forma segura sin crear la misma operación dos veces. AWS también recomienda tokens de idempotencia para pasos con efectos externos cuando existen reintentos. El principio no depende de una sola plataforma: si un proceso puede reintentarse, conviene diseñar qué significa 'la misma operación'.",
  "example":"Si una automatización crea una factura y la conexión falla después de enviarla pero antes de recibir confirmación, un reintento ingenuo podría crear otra. Una clave de operación única o una verificación previa puede impedir el duplicado según las capacidades del sistema.",
  "primary_sources":[{"title":"Idempotent requests","publisher":"Stripe API Reference","published_at":null,"url_or_reference":"https://docs.stripe.com/api/idempotent_requests","retrieved_at":"2026-09-05"},{"title":"Idempotency and retries","publisher":"AWS Durable Execution SDK Developer Guide","published_at":null,"url_or_reference":"https://docs.aws.amazon.com/durable-execution/patterns/best-practices/idempotency/","retrieved_at":"2026-09-05"}],
  "secondary_sources":[],
  "source_status":"PRIMARY_VERIFIED",
  "confidence":"A",
  "qa_tier":"QA-C",
  "interpretation_risks":["No todos los sistemas soportan idempotency keys; puede requerirse deduplicación o comprobación equivalente.","Idempotencia no elimina todos los tipos de fallo ni sustituye observabilidad, validación o permisos."],
  "forbidden_overclaims":["Decir que una idempotency key hace una automatización infalible.","Afirmar que todos los reintentos crean duplicados."],
  "content_franchise":"Errores caros",
  "angles":["La pregunta antes de automatizar: ¿qué pasa si se ejecuta dos veces?","Automatizar no basta: confirma y registra"],
  "hooks":["Antes de automatizar una acción, hazte esta pregunta: ¿qué ocurre si se ejecuta dos veces?"],
  "platform_potential":{"instagram":9,"facebook":8,"linkedin":10},
  "score":{"utility":10,"novelty":9,"clarity":8,"shareability":8,"saveability":10,"brand_fit":10,"commercial_signal":9},
  "status":"VERIFIED",
  "publication_ids":[],
  "experiment_ids":[],
  "created_at":"2026-09-05",
  "verified_at":"2026-09-05",
  "last_updated_at":"2026-09-05"
}
