{
  "idea_id":"KV-000004",
  "title_internal":"El primer número puede cambiar cómo juzgas los siguientes",
  "topic":"behavioral economics",
  "subtopic":"anchoring",
  "problem_or_decision":"Evaluar precios o cantidades partiendo de un número inicial que puede sesgar el juicio.",
  "audience":["consumidores","freelancers","ventas","emprendedores"],
  "main_claim":"Las personas pueden ajustar sus estimaciones desde un valor inicial o ancla, y ese punto de partida puede producir errores sistemáticos de juicio.",
  "practical_value":"Ayuda a reconocer anclas en presupuestos, precios, negociaciones y estimaciones.",
  "explanation":"Tversky y Kahneman describieron el ajuste desde un ancla como una heurística usada en predicciones numéricas, capaz de producir errores sistemáticos.",
  "example":"Un precio inicial alto puede convertirse en referencia mental para juzgar ofertas posteriores; no demuestra por sí solo que la oferta sea buena o mala.",
  "primary_sources":[{"title":"Judgment under Uncertainty: Heuristics and Biases","publisher":"Science / PubMed record","published_at":"1974-09-27","url_or_reference":"https://pubmed.ncbi.nlm.nih.gov/17835457/","retrieved_at":"2026-09-05"}],
  "secondary_sources":[],
  "source_status":"PRIMARY_VERIFIED",
  "confidence":"A",
  "qa_tier":"QA-B",
  "interpretation_risks":["El tamaño del efecto depende del contexto; no afirmar manipulación automática."],
  "forbidden_overclaims":["Decir que todo primer precio controla la decisión final."],
  "content_franchise":"Cómo funciona realmente",
  "angles":["Por qué el primer precio importa","La referencia invisible de una negociación"],
  "hooks":["El primer número que ves puede seguir influyendo incluso cuando sabes que es solo una referencia."],
  "platform_potential":{"instagram":9,"facebook":9,"linkedin":9},
  "score":{"utility":9,"novelty":8,"clarity":9,"shareability":9,"saveability":8,"brand_fit":9,"commercial_signal":8},
  "status":"VERIFIED",
  "publication_ids":[],
  "experiment_ids":[],
  "created_at":"2026-09-05",
  "verified_at":"2026-09-05",
  "last_updated_at":"2026-09-05"
}