{
  "idea_id":"KV-000015",
  "title_internal":"MFA: una segunda barrera cuando una contraseña se filtra",
  "topic":"digital security",
  "subtopic":"multi-factor-authentication",
  "problem_or_decision":"Depender de una sola contraseña para proteger una cuenta importante.",
  "audience":["personas","freelancers","microempresas"],
  "main_claim":"MFA exige dos o más autenticadores y dificulta el acceso no autorizado incluso si una contraseña o PIN se compromete.",
  "practical_value":"Una acción concreta y de bajo costo para reducir riesgo de toma de cuentas.",
  "explanation":"CISA recomienda MFA y señala que no todas sus formas son igual de seguras; las opciones resistentes al phishing ofrecen mayor protección.",
  "example":"Si una contraseña es robada, un atacante todavía debe superar el segundo factor; algunos métodos MFA siguen siendo vulnerables a phishing u otros ataques.",
  "primary_sources":[{"title":"Require Multifactor Authentication","publisher":"CISA","published_at":null,"url_or_reference":"https://www.cisa.gov/audiences/small-and-medium-businesses/secure-your-business/require-multifactor-authentication","retrieved_at":"2026-09-05"}],
  "secondary_sources":[],
  "source_status":"PRIMARY_VERIFIED",
  "confidence":"A",
  "qa_tier":"QA-B",
  "interpretation_risks":["No todas las modalidades MFA ofrecen el mismo nivel de protección."],
  "forbidden_overclaims":["Decir que MFA hace una cuenta imposible de hackear."],
  "content_franchise":"Herramienta que vale conocer",
  "angles":["La contraseña ya no debería ser tu única puerta","MFA no es una sola tecnología"],
  "hooks":["Si tu contraseña se filtra, MFA puede ser la barrera que todavía le falta al atacante."],
  "platform_potential":{"instagram":9,"facebook":10,"linkedin":9},
  "score":{"utility":10,"novelty":7,"clarity":9,"shareability":9,"saveability":10,"brand_fit":8,"commercial_signal":6},
  "status":"VERIFIED",
  "publication_ids":[],
  "experiment_ids":[],
  "created_at":"2026-09-05",
  "verified_at":"2026-09-05",
  "last_updated_at":"2026-09-05"
}