{
  "idea_id":"KV-000010",
  "title_internal":"Ingresos no son beneficio",
  "topic":"small-business finance",
  "subtopic":"revenue-vs-profit",
  "problem_or_decision":"Evaluar la salud de un negocio mirando solo facturación o ventas.",
  "audience":["microempresas","freelancers","emprendedores"],
  "main_claim":"Revenue/ingresos de ventas y beneficio no son lo mismo: el beneficio es lo que queda después de deducir los costos y gastos correspondientes.",
  "practical_value":"Evita confundir tamaño de ventas con rentabilidad.",
  "explanation":"Xero señala que revenue muestra ventas totales mientras profit muestra lo que queda después de gastos; una facturación alta no garantiza rentabilidad.",
  "example":"Dos negocios pueden facturar 10 millones y tener beneficios muy distintos si sus estructuras de costos son diferentes.",
  "primary_sources":[{"title":"What is revenue? Formula, calculation, and examples","publisher":"Xero","published_at":"2026-04-20","url_or_reference":"https://www.xero.com/us/guides/what-is-revenue/","retrieved_at":"2026-09-05"}],
  "secondary_sources":[],
  "source_status":"PRIMARY_VERIFIED",
  "confidence":"A",
  "qa_tier":"QA-B",
  "interpretation_risks":["Distinguir revenue bruto/neto y beneficio bruto/neto según contexto."],
  "forbidden_overclaims":["Usar una sola definición contable sin indicar el nivel de beneficio cuando sea material."],
  "content_franchise":"Lo que nadie te explica",
  "angles":["Facturar mucho no demuestra ganar mucho","El número grande que puede engañarte"],
  "hooks":["Un negocio puede vender muchísimo y aun ganar muy poco —o perder dinero."],
  "platform_potential":{"instagram":9,"facebook":9,"linkedin":10},
  "score":{"utility":10,"novelty":7,"clarity":10,"shareability":9,"saveability":9,"brand_fit":10,"commercial_signal":10},
  "status":"VERIFIED",
  "publication_ids":[],
  "experiment_ids":[],
  "created_at":"2026-09-05",
  "verified_at":"2026-09-05",
  "last_updated_at":"2026-09-05"
}