{
  "idea_id":"KV-000013",
  "title_internal":"La tarifa por hora puede ocultar cuánto realmente ganas",
  "topic":"freelancing",
  "subtopic":"effective-hourly-rate-total-time",
  "problem_or_decision":"Mirar solo horas facturadas y olvidar tiempo no facturable al estimar el rendimiento real del trabajo.",
  "audience":["freelancers","agencias","servicios profesionales"],
  "main_claim":"Una tarifa facturada por hora no equivale necesariamente al ingreso por cada hora total dedicada al negocio; si existen horas no facturables, el ingreso dividido por el tiempo total es menor que la tarifa facturada.",
  "practical_value":"Ayuda a incorporar ventas, administración, preparación y otras horas reales al evaluar precios y capacidad.",
  "explanation":"Es una identidad aritmética: ingreso efectivo por hora total = ingreso del periodo / horas totales dedicadas. Si solo una parte de esas horas es facturable, una tarifa de facturación puede sobreestimar el ingreso por hora total antes de gastos e impuestos.",
  "example":"20 horas facturadas a 100 generan 2.000 de ingresos. Si el trabajo total del periodo requiere 30 horas incluyendo 10 no facturables, 2.000/30 = 66,67 de ingreso por hora total antes de gastos e impuestos.",
  "primary_sources":[],
  "secondary_sources":["Transparent arithmetic derivation in explanation."],
  "source_status":"SUPPORTED",
  "confidence":"A",
  "qa_tier":"QA-C",
  "interpretation_risks":["No confundir ingreso por hora total con beneficio neto; gastos e impuestos pueden reducirlo más.","La proporción de horas facturables varía mucho entre actividades."],
  "forbidden_overclaims":["Afirmar una tasa universal de utilización o porcentaje de horas no facturables.","Presentar el ejemplo como benchmark de mercado."],
  "content_franchise":"El número que importa",
  "angles":["Tu tarifa publicada no es tu tarifa efectiva","Cuenta también las horas que nadie factura"],
  "hooks":["Cobrar 100 por hora no significa necesariamente ganar 100 por cada hora que trabajas."],
  "platform_potential":{"instagram":10,"facebook":9,"linkedin":10},
  "score":{"utility":10,"novelty":8,"clarity":10,"shareability":9,"saveability":10,"brand_fit":10,"commercial_signal":10},
  "status":"VERIFIED",
  "publication_ids":[],
  "experiment_ids":[],
  "created_at":"2026-09-05",
  "verified_at":"2026-09-05",
  "last_updated_at":"2026-09-05"
}
