{
  "idea_id":"KV-000016",
  "title_internal":"QR no significa confiable: el enlace sigue importando",
  "topic":"digital security",
  "subtopic":"qr-phishing",
  "problem_or_decision":"Escanear códigos QR suponiendo que el formato visual confirma legitimidad.",
  "audience":["consumidores","personas","microempresas"],
  "main_claim":"Un código QR puede dirigir a un sitio falso o malicioso; conviene revisar el destino antes de abrirlo y desconfiar de códigos inesperados o alterados.",
  "practical_value":"Previene una forma de phishing que oculta visualmente la URL hasta el escaneo.",
  "explanation":"La FTC ha documentado reportes de QR fraudulentos colocados sobre códigos legítimos y recomienda inspeccionar la URL, mantener el dispositivo actualizado y proteger cuentas con contraseñas fuertes y MFA.",
  "example":"Un adhesivo QR falso sobre un parquímetro puede dirigir a un sitio de pago fraudulento.",
  "primary_sources":[{"title":"See a QR code parked somewhere? Don’t scan it…yet!","publisher":"U.S. Federal Trade Commission","published_at":"2026-09-03","url_or_reference":"https://consumer.ftc.gov/consumer-alerts/2026/09/see-qr-code-parked-somewhere-dont-scan-ityet","retrieved_at":"2026-09-05"}],
  "secondary_sources":[],
  "source_status":"PRIMARY_VERIFIED",
  "confidence":"A",
  "qa_tier":"QA-B",
  "interpretation_risks":["No insinuar que los QR son inherentemente inseguros."],
  "forbidden_overclaims":["Decir que escanear cualquier QR instala malware automáticamente."],
  "content_franchise":"Lo que nadie te explica",
  "angles":["El QR puede ocultarte la parte que más deberías mirar","Antes de pagar con QR, revisa esto"],
  "hooks":["Un QR puede verse idéntico al legítimo y enviarte a otro sitio."],
  "platform_potential":{"instagram":10,"facebook":10,"linkedin":8},
  "score":{"utility":10,"novelty":9,"clarity":10,"shareability":10,"saveability":10,"brand_fit":8,"commercial_signal":5},
  "status":"VERIFIED",
  "publication_ids":[],
  "experiment_ids":[],
  "created_at":"2026-09-05",
  "verified_at":"2026-09-05",
  "last_updated_at":"2026-09-05"
}