{
  "idea_id":"KV-000008",
  "title_internal":"Descuento anual vs mensual: normaliza antes de comparar",
  "topic":"subscriptions",
  "subtopic":"period-normalization",
  "problem_or_decision":"Comparar planes con periodos distintos usando porcentajes sin convertirlos a la misma base.",
  "audience":["personas","freelancers","microempresas"],
  "main_claim":"Para comparar correctamente un plan mensual con uno anual, primero deben expresarse ambos en el mismo periodo y luego calcular la diferencia porcentual sobre una base explícita.",
  "practical_value":"Evita aceptar un porcentaje promocional sin comprobar cuánto dinero representa realmente.",
  "explanation":"Es una identidad aritmética. Si un plan mensual cuesta 120, doce meses cuestan 1.440. Si el anual cuesta 1.200, el ahorro es 240 y el descuento contra el equivalente mensual anualizado es 240/1.440=16,67%.",
  "example":"120 al mes vs 1.200 al año no es 'ahorrar dos meses' de forma abstracta: equivale a ahorrar 240 frente a 1.440, es decir 16,67% bajo esa comparación.",
  "primary_sources":[],
  "secondary_sources":["Transparent arithmetic derivation in explanation."],
  "source_status":"SUPPORTED",
  "confidence":"A",
  "qa_tier":"QA-C",
  "interpretation_risks":["Promociones pueden incluir impuestos, cargos, periodos introductorios o condiciones adicionales."],
  "forbidden_overclaims":["Asumir que el plan anual es mejor sin considerar uso, cancelación o costo de oportunidad."],
  "content_franchise":"El número que importa",
  "angles":["Convierte todo al mismo periodo","El porcentaje del plan anual que debes comprobar tú mismo"],
  "hooks":["Antes de creer el 'ahorra X%', convierte ambos planes al mismo periodo."],
  "platform_potential":{"instagram":9,"facebook":9,"linkedin":7},
  "score":{"utility":9,"novelty":7,"clarity":10,"shareability":8,"saveability":10,"brand_fit":9,"commercial_signal":7},
  "status":"VERIFIED",
  "publication_ids":[],
  "experiment_ids":[],
  "created_at":"2026-09-05",
  "verified_at":"2026-09-05",
  "last_updated_at":"2026-09-05"
}