{
  "idea_id":"KV-000017",
  "title_internal":"La IA puede sonar segura y aun estar equivocada",
  "topic":"AI literacy",
  "subtopic":"confabulation",
  "problem_or_decision":"Confiar en una respuesta generativa por su fluidez o seguridad aparente.",
  "audience":["personas","freelancers","microempresas","profesionales"],
  "main_claim":"Los sistemas de IA generativa pueden producir contenido falso o erróneo presentado con confianza; el riesgo importa especialmente en decisiones de consecuencias altas.",
  "practical_value":"Promueve una rutina de verificación antes de actuar sobre resultados de IA.",
  "explanation":"NIST denomina confabulation a respuestas erróneas o falsas presentadas de forma convincente y advierte que pueden incluir lógica o citas fabricadas.",
  "example":"Una respuesta puede incluir una fuente que parece real pero no existe; la afirmación importante debe comprobarse en la fuente original.",
  "primary_sources":[{"title":"Artificial Intelligence Risk Management Framework: Generative Artificial Intelligence Profile","publisher":"NIST","published_at":"2024-07-26","url_or_reference":"https://www.nist.gov/publications/artificial-intelligence-risk-management-framework-generative-artificial-intelligence","retrieved_at":"2026-09-05"}],
  "secondary_sources":[],
  "source_status":"PRIMARY_VERIFIED",
  "confidence":"A",
  "qa_tier":"QA-B",
  "interpretation_risks":["No afirmar que toda respuesta generativa es falsa ni que todos los modelos tienen el mismo nivel de riesgo."],
  "forbidden_overclaims":["Decir que la IA siempre inventa datos.","Presentar fluidez como prueba de falsedad."],
  "content_franchise":"Cómo funciona realmente",
  "angles":["La confianza del texto no es evidencia","La regla de verificación antes de usar IA para algo importante"],
  "hooks":["Una respuesta puede sonar completamente segura y aun incluir un dato o una fuente inventada."],
  "platform_potential":{"instagram":10,"facebook":9,"linkedin":10},
  "score":{"utility":10,"novelty":8,"clarity":10,"shareability":10,"saveability":10,"brand_fit":10,"commercial_signal":8},
  "status":"VERIFIED",
  "publication_ids":[],
  "experiment_ids":[],
  "created_at":"2026-09-05",
  "verified_at":"2026-09-05",
  "last_updated_at":"2026-09-05"
}