{
  "idea_id":"KV-000006",
  "title_internal":"La opción predeterminada puede decidir más de lo que parece",
  "topic":"behavioral economics",
  "subtopic":"default-effect",
  "problem_or_decision":"Aceptar una opción preseleccionada sin evaluar si coincide con la preferencia propia.",
  "audience":["consumidores","producto digital","marketing","emprendedores"],
  "main_claim":"Las opciones preseleccionadas suelen aumentar la probabilidad de que esa alternativa sea elegida, aunque la magnitud del efecto varía por contexto.",
  "practical_value":"Hace visible una parte de la arquitectura de elección en formularios, suscripciones y configuraciones.",
  "explanation":"Una meta-análisis de 58 estudios con n combinado de 73.675 encontró una influencia considerable de los defaults, junto con variación sustancial entre estudios.",
  "example":"Una casilla preseleccionada o un plan por defecto puede aumentar su adopción; eso no significa que siempre domine la decisión.",
  "primary_sources":[{"title":"When and why defaults influence decisions: a meta-analysis of default effects","publisher":"Behavioural Public Policy / Cambridge University Press","published_at":"2019-01-24","url_or_reference":"https://www.cambridge.org/core/journals/behavioural-public-policy/article/when-and-why-defaults-influence-decisions-a-metaanalysis-of-default-effects/67AF6972CFB52698A60B6BD94B70C2C0","retrieved_at":"2026-09-05"}],
  "secondary_sources":[],
  "source_status":"PRIMARY_VERIFIED",
  "confidence":"A",
  "qa_tier":"QA-B",
  "interpretation_risks":["La efectividad varía; algunos estudios no encuentran efectos significativos o encuentran efectos negativos."],
  "forbidden_overclaims":["Decir que una opción predeterminada obliga a elegirla."],
  "content_franchise":"Cómo funciona realmente",
  "angles":["La decisión que tomas sin decidir","Por qué conviene revisar lo que viene marcado"],
  "hooks":["Una opción marcada por defecto no es neutral: puede cambiar lo que terminamos eligiendo."],
  "platform_potential":{"instagram":9,"facebook":9,"linkedin":10},
  "score":{"utility":9,"novelty":9,"clarity":9,"shareability":9,"saveability":8,"brand_fit":9,"commercial_signal":9},
  "status":"VERIFIED",
  "publication_ids":[],
  "experiment_ids":[],
  "created_at":"2026-09-05",
  "verified_at":"2026-09-05",
  "last_updated_at":"2026-09-05"
}